{
  "capability_id": "example-service-work-write",
  "state": "ready",
  "support_class": "supported",
  "freshness_class": "reprobe-before-write",
  "last_verified_utc": "<timestamp-utc>",
  "evidence": "<artifact-root>/capability-validation-runs/run-0000/results.json",
  "constraint_or_fallback": "Write intents must run a fresh probe first; a passing row alone does not license a mutation. If the API lane fails with a named predicate, the managed browser profile is the only sanctioned fallback and the account must be independently verified.",
  "provenance": "helper-backed",
  "route_ref": "example-service-work-workspace",
  "probe_ref": "example-service-work-readiness"
}
